ID,Title,Author,Link,Date,Dates.N
1,"Bitcoin (BTC) Secures Biggest Fakeout of Q4, 2025: Will It Destroy $100,000?",Arman Shirinyan,https://u.today/bitcoin-btc-secures-biggest-fakeout-of-q4-2025-will-it-destroy-100000,"Oct 14, 2025 - 11:23",2025-10-14 11:23:00
2,'Not the Best Financial Advice' Peter McCormack Slams Peter Schiff's BTC Criticism,Godfrey Benjamin,https://u.today/not-the-best-financial-advice-peter-mccormack-slams-peter-schiffs-btc-criticism,"Oct 14, 2025 - 11:13",2025-10-14 11:13:00
3,"Crypto Market Prediction: Is This Biggest XRP Comeback in History? Bitcoin (BTC) Breaks $115,000 Like It's Nothing, Shiba Inu (SHIB): Not Adding Zero",Arman Shirinyan,https://u.today/crypto-market-prediction-is-this-biggest-xrp-comeback-in-history-bitcoin-btc-breaks-115000-like-its,"Oct 14, 2025 - 0:01",2025-10-14 00:01:00
4,"XRP Holders Didn't Panic Despite 50% Price Drop, Peter Brandt Issues Bullish Verdict on Bitcoin (BTC), Shiba Inu (SHIB) Back in 2023 — Crypto News Digest",Dan Burgin,https://u.today/xrp-holders-didnt-panic-despite-50-price-drop-peter-brandt-issues-bullish-verdict-on-bitcoin-btc,"Oct 13, 2025 - 18:50",2025-10-13 18:50:00
5,Bitcoin (BTC) Price Analysis for October 13,Denys Serhiichuk,https://u.today/bitcoin-btc-price-analysis-for-october-13-0,"Oct 13, 2025 - 16:17",2025-10-13 16:17:00
6,Legendary Trader Peter Brandt Adds '5% BTC' to Retirement Plans,Godfrey Benjamin,https://u.today/legendary-trader-peter-brandt-adds-5-btc-to-retirement-plans,"Oct 13, 2025 - 16:14",2025-10-13 16:14:00
7,"Crypto Market Prediction: Is Shiba Inu (SHIB) Bottom Officially Reached? Bitcoin (BTC) Is Stronger Than You Think, Is XRP Bound to $1 Now?",Arman Shirinyan,https://u.today/crypto-market-prediction-is-shiba-inu-shib-bottom-officially-reached-bitcoin-btc-is-stronger-than,"Oct 13, 2025 - 0:01",2025-10-13 00:01:00
8,BTC and ETH Rally as $257 Million Worth of Shorts Get Liquidated,Alex Dovbnya,https://u.today/btc-and-eth-rally-as-257-million-worth-of-shorts-get-liquidated,"Oct 12, 2025 - 18:55",2025-10-12 18:55:00
9,Bitcoin (BTC) Price Analysis for October 12,Denys Serhiichuk,https://u.today/bitcoin-btc-price-analysis-for-october-12-0,"Oct 12, 2025 - 14:44",2025-10-12 14:44:00
10,"Bitcoin (BTC) Price Could Plunge to $75,000, Schiff Predicts",Alex Dovbnya,https://u.today/bitcoin-btc-price-could-plunge-to-75000-schiff-predicts,"Oct 12, 2025 - 10:19",2025-10-12 10:19:00
11,Bitcoin (BTC) Price Analysis for October 11,Denys Serhiichuk,https://u.today/bitcoin-btc-price-analysis-for-october-11,"Oct 11, 2025 - 15:03",2025-10-11 15:03:00
12,BTC vs. ETH: Why Ethereum Price Lags Behind Bitcoin,Dan Burgin,https://u.today/opinions/btc-vs-eth-why-ethereum-price-lags-behind-bitcoin,"Oct 11, 2025 - 6:50",2025-10-11 06:50:00
13,"Morning Crypto Report: 'Bitcoin Jesus' Free? XRP Bulls Crushed in 3,192% Liquidation Imbalance Bloodbath, Whale Bets $600 Million Against BTC",Gamza Khanzadaev,https://u.today/morning-crypto-report-bitcoin-jesus-free-xrp-bulls-crushed-in-3192-liquidation-imbalance-bloodbath,"Oct 10, 2025 - 11:47",2025-10-10 11:47:00
14,"Crypto Market Prediction: XRP to Enter Freefall, Critical Support Lost? Bitcoin (BTC) Hits $120,000 Top, Shiba Inu (SHIB) Bullish Reversal Starts Here",Arman Shirinyan,https://u.today/crypto-market-prediction-xrp-to-enter-freefall-critical-support-lost-bitcoin-btc-hits-120000-top,"Oct 10, 2025 - 0:01",2025-10-10 00:01:00
15,"Peter Brandt Sounds Alarm on Bitcoin (BTC), New XRP ETF with 3x Leverage Proposed, Cardano Founder Predicts Shift in Altcoin Season — Crypto News Digest",Dan Burgin,https://u.today/peter-brandt-sounds-alarm-on-bitcoin-btc-new-xrp-etf-with-3x-leverage-proposed-cardano-founder,"Oct 9, 2025 - 18:03",2025-10-09 18:03:00
16,Bitcoin (BTC) Price Analysis for October 9,Denys Serhiichuk,https://u.today/bitcoin-btc-price-analysis-for-october-9-0,"Oct 9, 2025 - 15:44",2025-10-09 15:44:00
17,"Bitcoin (BTC) Price to $112,000? Upside Rally Still Intact",Godfrey Benjamin,https://u.today/bitcoin-btc-price-to-112000-upside-rally-still-intact,"Oct 9, 2025 - 15:42",2025-10-09 15:42:00
18,"XRP Drops Out of Top 3, Dogecoin Creator Breaks Silence on Bitcoin (BTC) Price, Shiba Inu (SHIB) Sees 70% Spike in 48 Hours — Crypto News Digest",Dan Burgin,https://u.today/xrp-drops-out-of-top-3-dogecoin-creator-breaks-silence-on-bitcoin-price-shiba-inu-shib-sees-70,"Oct 8, 2025 - 16:31",2025-10-08 16:31:00
19,"Can Bitcoin (BTC) Hit $150,000? 3 Key Factors",Arman Shirinyan,https://u.today/can-bitcoin-btc-hit-150000-3-key-factors,"Oct 8, 2025 - 13:26",2025-10-08 13:26:00
20,"Crypto Market Prediction: Bitcoin (BTC) Troubled at $123,000, Shiba Inu (SHIB) Hits Key Moment After Four Months, Ethereum (ETH) to Hit $5,000 After These Three",Arman Shirinyan,https://u.today/crypto-market-prediction-bitcoin-btc-troubled-at-123000-shiba-inu-shib-hits-key-moment-after-four,"Oct 8, 2025 - 0:01",2025-10-08 00:01:00
21,Bitcoin (BTC) Price Analysis for October 7,Denys Serhiichuk,https://u.today/bitcoin-btc-price-analysis-for-october-7-0,"Oct 7, 2025 - 14:12",2025-10-07 14:12:00
22,"Morning Crypto Report: $610 Million XRP Surprise by Ripple, Bitcoin (BTC) Smashes $126,000 Record, Shiba Inu (SHIB) Faces Survival Questions",Gamza Khanzadaev,https://u.today/morning-crypto-report-610-million-xrp-surprise-by-ripple-bitcoin-btc-smashes-126000-record-shiba,"Oct 7, 2025 - 10:17",2025-10-07 10:17:00
23,"Crypto Market Prediction: XRP Delivers Legendary Price Pattern, Ethereum (ETH) Consolidates for $4,500, No $150,000 Bitcoin (BTC)?",Arman Shirinyan,https://u.today/crypto-market-prediction-xrp-delivers-legendary-price-pattern-ethereum-eth-consolidates-for-4500-no,"Oct 7, 2025 - 0:01",2025-10-07 00:01:00
24,Bitcoin (BTC) Price Analysis for October 6,Denys Serhiichuk,https://u.today/bitcoin-btc-price-analysis-for-october-6,"Oct 6, 2025 - 15:47",2025-10-06 15:47:00
25,"Crypto Market Prediction: Bitcoin (BTC) ATH Is Nothing, XRP Begins $5 Run, Shiba Inu (SHIB) No Choice at $0.000013",Arman Shirinyan,https://u.today/crypto-market-prediction-bitcoin-btc-ath-is-nothing-xrp-begins-5-run-shiba-inu-shib-no-choice-at,"Oct 6, 2025 - 0:01",2025-10-06 00:01:00
26,Bitcoin (BTC) Price Prediction for October 5,Denys Serhiichuk,https://u.today/bitcoin-btc-price-prediction-for-october-5-0,"Oct 5, 2025 - 15:41",2025-10-05 15:41:00
27,"‘Good Chance’ BTC Tops Several Weeks from Now, Analysts Claim",Alex Dovbnya,https://u.today/good-chance-btc-tops-several-weeks-from-now-analysts-claim,"Oct 5, 2025 - 15:04",2025-10-05 15:04:00
28,"BREAKING: Bitcoin (BTC) Finally Hits New ATH; Is $135,000 Likely?",Alex Dovbnya,https://u.today/breaking-bitcoin-btc-finally-hits-new-ath-is-135000-likely,"Oct 5, 2025 - 5:36",2025-10-05 05:36:00
29,Bitcoin (BTC) Price Prediction for October 4,Denys Serhiichuk,https://u.today/bitcoin-btc-price-prediction-for-october-4,"Oct 4, 2025 - 16:32",2025-10-04 16:32:00
30,"Dogecoin (DOGE) Confirms First Golden Cross, Shiba Inu (SHIB) Downtrend Ending, Bitcoin (BTC) Price Hits $120,000, Eyes New ATH — Crypto News Digest",Dan Burgin,https://u.today/dogecoin-doge-confirms-first-golden-cross-shiba-inu-shib-downtrend-ending-bitcoin-btc-price-hits,"Oct 3, 2025 - 22:57",2025-10-03 22:57:00
31,"Bitcoin (BTC) to Hit $200,000 by End of 2025, Standard Chartered Predicts",Alex Dovbnya,https://u.today/bitcoin-btc-to-hit-200000-by-end-of-2025-standard-chartered-predicts,"Oct 3, 2025 - 16:34",2025-10-03 16:34:00
32,Bitcoin (BTC) Price Prediction for October 3,Denys Serhiichuk,https://u.today/bitcoin-btc-price-prediction-for-october-3,"Oct 3, 2025 - 14:03",2025-10-03 14:03:00
33,"Bitcoin (BTC) Can Even Hit $200,000, According to Popular Indicator",Arman Shirinyan,https://u.today/bitcoin-btc-can-even-hit-200000-according-to-popular-indicator,"Oct 3, 2025 - 13:09",2025-10-03 13:09:00
34,"Crypto Market Prediction: XRP Ready for $3, Bitcoin (BTC) Can't Handle It, Is Shiba Inu (SHIB) Ready for $0.00002?",Arman Shirinyan,https://u.today/crypto-market-prediction-xrp-ready-for-3-bitcoin-btc-cant-handle-it-is-shiba-inu-shib-ready-for,"Oct 3, 2025 - 0:01",2025-10-03 00:01:00
35,"$3,700,000,000 BTC Profit-Taking Shakes Crypto Market, What's Next?",Tomiwabold Olajide,https://u.today/3700000000-btc-profit-taking-shakes-crypto-market-whats-next,"Oct 2, 2025 - 18:48",2025-10-02 18:48:00
36,"Bitcoin's (BTC) Profit-Taking Stage Comes, USDT/USDC Duopoly Might End Soon, Tether's Cap to $1 Trillion: Crypto News Recap",Vladislav Sopov,https://u.today/bitcoins-btc-profit-taking-stage-comes-usdtusdc-duopoly-might-end-soon-tethers-cap-to-1-trillion,"Oct 2, 2025 - 15:30",2025-10-02 15:30:00
37,"BREAKING: CME Group to Offer 24/7 Trading for XRP, SOL, BTC, and Other Crypto Futures",Alex Dovbnya,https://u.today/breaking-cme-group-to-offer-247-trading-for-xrp-sol-btc-and-other-crypto-futures,"Oct 2, 2025 - 14:16",2025-10-02 14:16:00
38,"Crypto Market Prediction: Bitcoin (BTC) to Rocket to $130,000? Shiba Inu (SHIB) Hits $0.000012 Breakout, XRP Breaks 5 Resistances in 1 Move",Arman Shirinyan,https://u.today/crypto-market-prediction-bitcoin-btc-to-rocket-to-130000-shiba-inu-shib-hits-0000012-breakout-xrp,"Oct 2, 2025 - 0:01",2025-10-02 00:01:00
39,"Ripple CTO Resigns, XRP Bear Destroyed After Massive Short, Bitcoin (BTC) Price to $150,000 — Crypto News Digest",Dan Burgin,https://u.today/ripple-cto-resigns-xrp-bear-destroyed-after-massive-short-bitcoin-btc-price-to-150000-crypto-news,"Oct 1, 2025 - 16:26",2025-10-01 16:26:00
40,Bitcoin (BTC) Price Analysis for October 1,Denys Serhiichuk,https://u.today/bitcoin-btc-price-analysis-for-october-1,"Oct 1, 2025 - 15:17",2025-10-01 15:17:00
41,"$125 Billion Satoshi BTC Wallet Attracts Speculation Amid XRP, Market Developments",Tomiwabold Olajide,https://u.today/125-billion-satoshi-btc-wallet-attracts-speculation-amid-xrp-market-developments,"Oct 1, 2025 - 11:10",2025-10-01 11:10:00
42,"Crypto Market Prediction: XRP Should Not Celebrate Too Early, Did Ethereum (ETH) Secure $4,200? This Is Bitcoin's (BTC) $113,000 Chance",Arman Shirinyan,https://u.today/crypto-market-prediction-xrp-should-not-celebrate-too-early-did-ethereum-eth-secure-4200-this-is,"Oct 1, 2025 - 0:01",2025-10-01 00:01:00
43,Bitcoin (BTC) Price Analysis for September 29,Denys Serhiichuk,https://u.today/bitcoin-btc-price-analysis-for-september-29-0,"Sep 29, 2025 - 14:03",2025-09-29 14:03:00
44,"Crypto Market Prediction:  Shiba Inu (SHIB) in Free Fall to Add Zero, Ethereum (ETH) Secures $4,000, Bitcoin (BTC): $110,000 Comeback Attempt",Arman Shirinyan,https://u.today/crypto-market-prediction-shiba-inu-shib-in-free-fall-to-add-zero-ethereum-eth-secures-4000-bitcoin,"Sep 29, 2025 - 0:01",2025-09-29 00:01:00
45,Bitcoin (BTC) Price Prediction for September 28,Denys Serhiichuk,https://u.today/bitcoin-btc-price-prediction-for-september-28-0,"Sep 28, 2025 - 13:24",2025-09-28 13:24:00
46,First Bitcoiner in Space Says BTC Will Survive Quantum Computing,Alex Dovbnya,https://u.today/first-bitcoiner-in-space-says-btc-will-survive-quantum-computing,"Sep 28, 2025 - 10:31",2025-09-28 10:31:00
47,"$200,000 BTC: Mike Novogratz Predicts Bitcoin Price Surge",Dan Burgin,https://u.today/200000-btc-mike-novogratz-predicts-bitcoin-price-surge,"Sep 27, 2025 - 11:24",2025-09-27 11:24:00
48,Bitcoin (BTC) Price Prediction for September 27,Denys Serhiichuk,https://u.today/bitcoin-btc-price-prediction-for-september-27-0,"Sep 27, 2025 - 10:31",2025-09-27 10:31:00
49,"Crypto Market Prediction: Ethereum (ETH) Can Start $5,000 Path Here, XRP Welcomes $2.60, Bitcoin's (BTC) Bullish $108,000 Reversal",Arman Shirinyan,https://u.today/crypto-market-prediction-ethereum-eth-can-start-5000-path-here-xrp-welcomes-260-bitcoins-btc,"Sep 27, 2025 - 0:01",2025-09-27 00:01:00
50,Bitcoin (BTC) Price Prediction for September 26,Denys Serhiichuk,https://u.today/bitcoin-btc-price-prediction-for-september-26,"Sep 26, 2025 - 16:31",2025-09-26 16:31:00
51,"World AI Show Welcomes MIDA as Strategic Investment Partner, Strengthening Malaysia’s Position as AI & Investment Hub",,https://u.today/press-releases/world-ai-show-welcomes-mida-as-strategic-investment-partner-strengthening-malaysias,,
52,"Intelligence Awakens, Civilization Sets Sail: ARK DAO Launches, Opening a New Era of AI and Community Co-Governance in Decentralization",,https://u.today/press-releases/intelligence-awakens-civilization-sets-sail-ark-dao-launches-opening-a-new-era-of-ai,,
53,ViaBTC Unveils Enhanced Collateralized Loan Service for Global Miners,,https://u.today/press-releases/viabtc-unveils-enhanced-collateralized-loan-service-for-global-miners,,
54,How High Will Bitcoin (BTC) Price Go In 2025?,Dan Burgin,https://u.today/opinions/how-high-will-bitcoin-btc-price-go-in-2025,"Jul 28, 2025 - 2:20",2025-07-28 02:20:00
55,"Bitget Wallet, The All-in-One Crypto Wallet for Everyday Mobile Users: Big Review",Vladislav Sopov,https://u.today/reviews/bitget-wallet-the-all-in-one-crypto-wallet-for-everyday-mobile-users-big-review,"Jul 15, 2025 - 11:00",2025-07-15 11:00:00
56,From Exchange to Ecosystem: HTX Redefines What CEX Means in the New Crypto Cycle,U.Today Editorial Team,https://u.today/reviews/from-exchange-to-ecosystem-htx-redefines-what-cex-means-in-the-new-crypto-cycle,"Jul 14, 2025 - 4:30",2025-07-14 04:30:00
57,Silent Data Ethereum L2 Launched by Applied Blockchain: Details,Vladislav Sopov,https://u.today/reviews/silent-data-ethereum-l2-launched-by-applied-blockchain-details,"Jul 11, 2025 - 10:02",2025-07-11 10:02:00
58,Redefining Role of CEXes and Building Trust Gateway in Web3 Era: Big Interview with Coinstore CEO Johnson Zhao,U.Today Editorial Team,https://u.today/interviews/redefining-role-of-cexes-and-building-trust-gateway-in-web3-era-big-interview-with-coinstore-ceo,"Jul 7, 2025 - 12:18",2025-07-07 12:18:00
59,Urgent Shiba Inu Alert Issued as Fake SHIB Sites Target Wallets: Details,Alex Dovbnya,https://u.today/urgent-shiba-inu-alert-issued-as-fake-shib-sites-target-wallets-details,"Oct 14, 2025 - 11:29",2025-10-14 11:29:00
60,"Bitcoin (BTC) Secures Biggest Fakeout of Q4, 2025: Will It Destroy $100,000?",Alex Dovbnya,https://u.today/bitcoin-btc-secures-biggest-fakeout-of-q4-2025-will-it-destroy-100000,"Oct 14, 2025 - 11:23",2025-10-14 11:23:00
61,'Not the Best Financial Advice' Peter McCormack Slams Peter Schiff's BTC Criticism,Alex Dovbnya,https://u.today/not-the-best-financial-advice-peter-mccormack-slams-peter-schiffs-btc-criticism,"Oct 14, 2025 - 11:13",2025-10-14 11:13:00
